"conversation_id_str","created_at","favorite_count","full_text","id_str","image_url","in_reply_to_screen_name","lang","location","quote_count","reply_count","retweet_count","tweet_url","user_id_str","username"
"1920121507910701081","Wed May 07 14:20:16 +0000 2025","8","aku cantik dan lucu kali pantas pacarku bucin ️ https://t.co/FTf2xQAJJW","1920121507910701081","https://pbs.twimg.com/amplify_video_thumb/1920121445667188736/img/dPe0GZ2U_cy68U3H.jpg","","in","she/them","0","0","0","https://x.com/ichryni/status/1920121507910701081","1133217057229529089","ichryni"
"1921421702430396657","Sun May 11 04:26:46 +0000 2025","3","BUPUS SKY ITU BUPUS (bucin mampus) #SkyNani https://t.co/bViFq2YaMn","1921421702430396657","https://pbs.twimg.com/media/Gqo-SzqaIAA_0N2.jpg","","in","𝒔𝒌𝒚𝒏𝒂𝒏𝒊","0","0","1","https://x.com/stobellyyy/status/1921421702430396657","1741731797153759232","stobellyyy"
"1921369554174837100","Sun May 11 00:59:33 +0000 2025","8"," orang meriang aja ditulisnya gejala kematian SIAL KETAWA KENCENG BGT","1921369554174837100","","","in","Scarlet Sanctum","0","1","1","https://x.com/kioomiicaine/status/1921369554174837100","1639189712656302080","kioomiicaine"
"1919339043894001892","Mon May 05 10:31:02 +0000 2025","3","bukti aku had fun kemarin https://t.co/9KYOYH4jmj","1919339043894001892","https://pbs.twimg.com/amplify_video_thumb/1919338885836144640/img/89GQqBQ7_5eq9vzO.jpg","","in","SHE; HER; 2002","0","0","0","https://x.com/itsmeyeojaa/status/1919339043894001892","739679741548986368","itsmeyeojaa"
"1921207381746168173","Sat May 10 14:15:08 +0000 2025","19","ftd! gaesss bagi AU/WP JOSSGWIN yang joss nya rich bucin dan obsessed gitu donggg plzz plzz plz yg baik semoga kapalnya ada moment terussss️ tia oll! https://t.co/S9HJEEV0eS","1921207381746168173","https://pbs.twimg.com/media/Gql_7rAWYAAfF8g.jpg","","in","","1","2","3","https://x.com/fessthaii/status/1921207381746168173","1393735951239684100","fessthaii"
"1918650646275977595","Sat May 03 12:55:35 +0000 2025","15","Mohon maaf pembahasannya keluar Jalur tp ya si hongye itu diliat² dia bucin bnget ke istri nya tapi knpa ke anak nya jadi REDFLEG parah kasian bnget si fugui hidup nya menderita gara²bapaknya nangis bawang gw #LoveInPavilion https://t.co/dasJaoM32P","1918650646275977595","https://pbs.twimg.com/ext_tw_video_thumb/1918650586192625664/pu/img/ksDvNjz3sJrLQ_Ch.jpg","","in","","8","3","3","https://x.com/lvrywain/status/1918650646275977595","1659089606766370819","lvrywain"
"1919601800933523629","Tue May 06 03:55:08 +0000 2025","1041","ftd! Joss lagi ga enak badan tapi nemenin Gawin tanding basket. JOSS BUCIN BANGET https://t.co/67vDlHxfAa","1919601800933523629","https://pbs.twimg.com/media/GqPLqf7WEAATm7w.jpg","","in","","7","10","109","https://x.com/fessthaii/status/1919601800933523629","1393735951239684100","fessthaii"
"1921182921794216115","Sat May 10 12:37:57 +0000 2025","631"," WARNING SPOILER S2 kalian tim benci endo di awal tim bucin endo dari awal atau tim benci jadi cinta guys? https://t.co/HIVUjQeult","1921182921794216115","https://pbs.twimg.com/media/Gqlpr7AW4AAv2Pc.jpg","","in","RULES","112","111","29","https://x.com/Bofurin_Fess/status/1921182921794216115","1777741256598446084","Bofurin_Fess"
"1920516097951821907","Thu May 08 16:28:13 +0000 2025","21","the real bisa ngelawan 1000 orang yg suka kamu tapi gabisa ngelawan 1 orang yg kamu suka tapi lucu ngeliat u saltingan gini wkwk. Semoga cepet ketemu cowo yg pas biar ngeliat adelrevaaa ada di butterfly era bucin bucin sama cowonya ya ga @AdelRevaaa","1920516097951821907","","","in","Kota Medan, Sumatera Utara","0","0","0","https://x.com/wordelfaa/status/1920516097951821907","1666095074873319425","wordelfaa"
"1921509811998400606","Sun May 11 10:16:53 +0000 2025","5","TOXIC teriak TOXIC KALIAN LEBIH TOXIC DARI KITA BTW. kampoeng? iya deh kota","1921509811998400606","","","in","bikini bottom 🫧🪸🫙🐬🧜‍♀️","0","0","0","https://x.com/redhorse44/status/1921509811998400606","1642331059634442241","redhorse44"
"1921092541480353795","Sat May 10 06:38:48 +0000 2025","81","Baru kali ini masuk fandom yg punya gambar official fansnya IMUTT BANGET DIPAKEIN PITA WOIII AAARGGHH GA ENDUD/KURUS PERFECT VERSI KALEM BUCIN DAN SENGGOL BACOK JUGA ADA WKWKKWKW THANK YOU DDUKS https://t.co/ZtcrTsYFaf","1921092541480353795","https://pbs.twimg.com/media/GqkXewoWQAAKoiq.jpg","","in","","0","0","13","https://x.com/anaknyasonsam/status/1921092541480353795","949961869099286528","anaknyasonsam"
"1918295711453421823","Fri May 02 13:25:12 +0000 2025","4773"," &lt; an update dari si kucing bucin &gt; lagi ngambek krn ga sengaja keinjek https://t.co/KGbEQxd5YA","1918295711453421823","https://pbs.twimg.com/media/Gp8nyJSWQAArqHa.jpg","","in","ID","18","57","231","https://x.com/kochengfs/status/1918295711453421823","243647729","kochengfs"
"1921063720651813045","Sat May 10 04:44:17 +0000 2025","101","Congratulations to #Dilraba and Als on breaking 150 million posts on Super Topic. She is the first and only female star to achieve it #Dilireba #Dilraba #迪丽热巴 https://t.co/g0prC5Nr53","1921063720651813045","https://pbs.twimg.com/tweet_video_thumb/Gqj9ElubcAQWZLr.jpg","","en","","0","0","18","https://x.com/BucinYangDi1188/status/1921063720651813045","1448969372689526788","BucinYangDi1188"
"1918846275010625651","Sun May 04 01:52:57 +0000 2025","82","cape juga ya bucin sendirian kaya gini info bucinan baru dong","1918846275010625651","","","in","","2","71","3","https://x.com/vibesooul/status/1918846275010625651","1480881520134918146","vibesooul"
"1920827189785669874","Fri May 09 13:04:23 +0000 2025","6","Malu ih William bucin banget gamau kalah dia sama si cantik sama2 langsung update feed pake sendal couple astagaaaaa remaja #WilliamEst #williamjkp #est_rvp https://t.co/HHV7K4EXf0","1920827189785669874","https://pbs.twimg.com/media/GqgmHk4XwAEvsD7.jpg","","in","Wesley♡","0","1","0","https://x.com/mondayouth/status/1920827189785669874","263581273","mondayouth"
"1919698181107155274","Tue May 06 10:18:08 +0000 2025","171","Tetaplah memprioritaskan pendidikan atau karirmu jangan berhenti memperbaiki diri make it balance karena cinta yang dewasa bukan 24/7 bucin tetapi tahu kapan waktu untuk bekerja waktu untuk belajar waktu untuk me time dan waktu untuk ngobrol dengan pasangan.","1919698185142075609","","PikamonID","in","","1","1","38","https://x.com/PikamonID/status/1919698185142075609","1192761337","PikamonID"
"1919621791481250039","Tue May 06 05:14:34 +0000 2025","889","#williamEst long au Kisah seorang dosen teknik sipil yang terkenal karna disiplin tapi ternyata sangat bucin kepada sang kekasih. Gala si anak teknik sipil yang selalu membuat huru hara di kampus. Dewa wiratama dan gala aska saputra as main character https://t.co/IteTUoMWbQ","1919621791481250039","https://pbs.twimg.com/media/GqPd1fcbMAApTpv.jpg","","in","","5","1","150","https://x.com/VinaMargar45203/status/1919621791481250039","1712363111590862848","VinaMargar45203"
"1919702802768793663","Tue May 06 10:36:29 +0000 2025","112","️TW konten bucin lewaat ️ Seminggu lebih nikah masih di tahap adaptasi transisi yg tadinya ngurusin diri sendiri skrg ada bayi gede yg harus diurus jugaaa wkwk Pulang hanimun baru merasakan realita yg sesungguhnya dimulai inilah babak baru kehidupan https://t.co/JPkZke1Anx","1919702802768793663","https://pbs.twimg.com/media/GqQnhNobAAEg4P1.jpg","","in","Bekasi, Indonesia","0","6","3","https://x.com/fifiyuu/status/1919702802768793663","127092451","fifiyuu"
"1921416923255906552","Sun May 11 04:07:47 +0000 2025","77","Baba's tall stature slim waist and ideal proportions #Dilireba #Dilraba #迪丽热巴 #TheTruthS3 #TheTruth3 #开始推理吧3 #开始推理吧 https://t.co/yNpGMKlMx4","1921416923255906552","https://pbs.twimg.com/media/Gqo-dOqXAAAnNcm.jpg","","en","","1","0","18","https://x.com/BucinYangDi1188/status/1921416923255906552","1448969372689526788","BucinYangDi1188"
"1918547892647936114","Sat May 03 06:07:17 +0000 2025","35","The CCD photos of Reba were taken by Sister #JolinJin. A real Barbie #Dilireba #Dilraba #迪丽热巴 #TheTruthS3 #TheTruth3 #开始推理吧3 #开始推理吧 https://t.co/uJJ0H6GfK8","1918547892647936114","https://pbs.twimg.com/media/GqANIPAawAQKfvw.jpg","","en","","0","1","2","https://x.com/BucinYangDi1188/status/1918547892647936114","1448969372689526788","BucinYangDi1188"
"1920153533636358202","Wed May 07 16:27:31 +0000 2025","37","Jujur kangen Arya akting bucin WKWK jadi w pilih Arya","1920153533636358202","","","in","","0","3","0","https://x.com/flatlininggg2/status/1920153533636358202","1837348789671317504","flatlininggg2"
"1918352340249088215","Fri May 02 17:10:13 +0000 2025","92","[nihao] guys aku lagi butuh drama modern yg manis2 bucin akut gitu. Selain lvlmv hl tbt love is sweet fae road home only for love you are my secret tff Kayanya udh hampir ku tonton semua lg suntuk dg drama kostum soalnya *Gambar hanya pemanis https://t.co/wDIhn59AYF","1918352340249088215","https://pbs.twimg.com/media/Gp9bSRjWkAA7pTf.jpg","","in","patuhi rules 👉","1","34","4","https://x.com/mandarinfess/status/1918352340249088215","1263156707833704451","mandarinfess"
"1920144484228382762","Wed May 07 15:51:34 +0000 2025","19","ingfokan au/narasi yang bersangkutan dengan oknum Caine Chana tapi angst dan sad ending plss ak lagi pengen nangis tapi tida ada yang keluar kalo ga dipancing","1920144484228382762","","","in","Scarlet Sanctum","0","2","1","https://x.com/kioomiicaine/status/1920144484228382762","1639189712656302080","kioomiicaine"
"1917996575265370519","Thu May 01 17:36:32 +0000 2025","726","Perjalanan cinta di Rahasia Pertama versi gw: Pesona sederhana -&gt; beneran baru ketemu dan lagi mulai kasmaran Angin Rindu -&gt; kangen pengen ketemu lagi Tak Ada Ujungnya -&gt; mulai bucin banget Satu Alasan -&gt; udah mulai berhubungan berantem2 tapi ujungnya balik lagi","1917996575265370519","","","in","","2","2","124","https://x.com/itsvviii/status/1917996575265370519","1709029413395066880","itsvviii"
"1919949708543299929","Wed May 07 02:57:36 +0000 2025","2","Eris dan agenda bucin anak nyasarnya :3 https://t.co/E2J5sewxXq","1919949708543299929","https://pbs.twimg.com/media/GqUIFGWbAAEM91O.jpg","","in","wibu, buku, y.o.u.","0","1","0","https://x.com/eriselfish_/status/1919949708543299929","2589003852","eriselfish_"
"1920511561388732825","Thu May 08 16:10:12 +0000 2025","105","wonki one tweet au isinya cuma won bucin bucin (freak dikit) ke iki https://t.co/qzWgqo6Yo0","1920511561388732825","https://pbs.twimg.com/media/GqcHFgWWEAAjQY9.jpg","","in","rps nikreun mentok","3","1","31","https://x.com/okaerishi/status/1920511561388732825","1812119899181035520","okaerishi"
"1919264955498463653","Mon May 05 05:36:38 +0000 2025","16","Hope On The Stage Tour in Jakarta edisi ootd yang super simple ini #HOPE_ON_THE_STAGE_TOUR #JHOPE_TOUR #HOS_TOUR_JAKARTA #HOPE_ON_THE_STAGE_TOUR_JAKARTA https://t.co/jbM4cGUMWU","1919264955498463653","https://pbs.twimg.com/media/GqKZS-0aUAEBSeK.jpg","","en","","0","2","0","https://x.com/bucinLDR/status/1919264955498463653","225383069","bucinLDR"
"1919401884399321521","Mon May 05 14:40:44 +0000 2025","2","bucin sbg mamah ke yanqing atuh anak saya mah ganteng pekerja keras lucu nyimut #keren bodo amat dislander he s supposed to be remaja yg masi labil anyway siapapun yg menghina yanKING will fall camkan itu doa ibu didengar aeon https://t.co/X1hIBHGKxI","1919401884399321521","https://pbs.twimg.com/tweet_video_thumb/GqMV1aIaEAANYQa.jpg","","in","layout by mangomaitaii","0","1","0","https://x.com/K_KazuhaJKT48/status/1919401884399321521","1382981538904633347","K_KazuhaJKT48"
"1918317317471318337","Fri May 02 14:51:03 +0000 2025","118","; giliran kak hee yang lagi bucin bucinnya alias pacaran ala kak hee dan riki heeki one tweet au https://t.co/4uNPxHQJUH","1918317317471318337","https://pbs.twimg.com/media/Gp87brrboAAvRSG.jpg","","in","","3","0","32","https://x.com/heevxnz/status/1918317317471318337","1712115879008407552","heevxnz"
"1921450660026896456","Sun May 11 06:21:50 +0000 2025","7","yg benci sama mem bangtan smpe ngata²in gue sumpahin smoga suatu saat bucin mampus","1921450660026896456","","","in",". .♡ yoongi . ≽ܫ≼","0","2","0","https://x.com/inadtsuga/status/1921450660026896456","1183039998104199168","inadtsuga"
"1921407768252055971","Sun May 11 03:31:24 +0000 2025","5","abis nonton lagi dan baca bbrp komen gue kyknya makin yakin kalo jeyeon belum bener2 100% ke jimin dia juga jujur sih bilang ke jimin kalo dia msh cautious sm pilihannya gak langsung mantepin hati ke satu arah beda bgt sm jimin yg kayaknya udh bucin bgt sm jeyeon #HeartPairing","1921407768252055971","","","in","svtws & asian drama-film","1","1","0","https://x.com/gaccigayo/status/1921407768252055971","779173457313435648","gaccigayo"
"1920454061939188216","Thu May 08 12:21:43 +0000 2025","422","Genio tuh bucin bgt sama Aily pokoknya bucin banget titik gak pake koma. #jenrina #bluesy https://t.co/p7pcvFG3pM","1920454061939188216","https://pbs.twimg.com/media/GqbSyVsXMAAyezN.jpg","","in","rps.","1","1","62","https://x.com/souricles/status/1920454061939188216","3893876009","souricles"
"1921509227115290880","Sun May 11 10:14:34 +0000 2025","20","SinemArt &amp; SCTV: wah duit nih","1921509227115290880","","","in","bikini bottom 🫧🪸🫙🐬🧜‍♀️","0","1","0","https://x.com/redhorse44/status/1921509227115290880","1642331059634442241","redhorse44"
"1921509919280201911","Sun May 11 10:17:19 +0000 2025","62","fans lo dikit jadi ga mampu teriak kan? HAHAHAHA","1921509919280201911","","","in","bikini bottom 🫧🪸🫙🐬🧜‍♀️","0","3","2","https://x.com/redhorse44/status/1921509919280201911","1642331059634442241","redhorse44"
"1918597444142587911","Sat May 03 09:24:11 +0000 2025","5","Ikut lepas title madei stlh 8 tahun Beneran muak apalagi ini oknum² tolol mental maling pada masuk ntn ","1918597444142587911","","","in","Republic of Korea","0","1","2","https://x.com/bucin_goldie/status/1918597444142587911","2614590907","bucin_goldie"
"1919640431924486497","Tue May 06 06:28:38 +0000 2025","5","archive pas lagi bucin-bucin nya sama unpad until now ‍‍ https://t.co/Jfvdm2DzxO","1919640431924486497","https://pbs.twimg.com/media/GqPuxwwaMAA5r3Y.jpg","","in","FISIP/FIB UNPAD ","0","3","0","https://x.com/flauentiest/status/1919640431924486497","1552422575317614592","flauentiest"
"1921262558863892910","Sat May 10 17:54:24 +0000 2025","11","sebenarnya posisiku ini lucu kyk aku beneran bucin mampus sama Li tapi disisi lain aku memposisikan mcku itu org yg berbeda dari diriku sendiri kyk anakku gt lah ya aku jatohnya malah kyk ship Li x MC yg aku anggap bukan diriku sendiri tapi oc ku gt..","1921262558863892910","","","in","22↑","2","4","2","https://x.com/qinchesoul/status/1921262558863892910","1883439545422876673","qinchesoul"
"1921504424389652774","Sun May 11 09:55:29 +0000 2025","2","kpopers kalo dah ketemu cowo rl bucinnya setengah mati (fakta dari temen kpop sekitar) sebenernya udah bisa kebaca sih dari level bucin idol kpopnya tapi rata2 ketemu cwk ga bener terus galauin cwk rl nya bentar terus balik ke cwk kpopnya lagi gitu aja terus siklusnya","1921504424389652774","","","in","Himeji, Jepang","0","0","0","https://x.com/isnaimeiii/status/1921504424389652774","714351733","isnaimeiii"
"1919738983359094855","Tue May 06 13:00:15 +0000 2025","430","WilliamEst AU - bucin - #WilliamEst : @ontywesley https://t.co/aoKQvRmDTR","1919738983359094855","https://pbs.twimg.com/media/GqRIZ6lbAAAxu3m.jpg","","cy","onty wesley","4","1","67","https://x.com/ontywesley/status/1919738983359094855","1744618049460985856","ontywesley"
"1919010767384326254","Sun May 04 12:46:35 +0000 2025","93","i've always thought everlark is similar to shinran also happy birthday heisei holmes as a gift here is you not so angsty like how i usually draw #shinran #shinichikudo #ranmouri #detectiveconan #everlark #thg https://t.co/ZGHPrp3OdM","1919010767384326254","https://pbs.twimg.com/media/GqGyHw6bIAA57cZ.jpg","","en","","1","1","24","https://x.com/radotharu/status/1919010767384326254","1553779428945465344","radotharu"
"1921222086569161048","Sat May 10 15:13:34 +0000 2025","63","RT and like are very appreciated‼️‼️‼️ LOOKING FOR RESPONDEN BUCIN HERTA halo saya sedang mencari responden untuk mengisi kuesioner penelitian saya. kriterianya seperti yang tertera di foto kuesioner kali ini untuk pemilihan desain. https://t.co/4JqiyXAb0g","1921222086569161048","https://pbs.twimg.com/media/GqmNTkabcAAhlnD.jpg","","in","","7","18","71","https://x.com/scaramoucez/status/1921222086569161048","1373425752679485442","scaramoucez"
"1919144332650549562","Sun May 04 21:37:19 +0000 2025","273","AAAAAAAAAA AAAAAAAAAA LARII ADA BUCIN gerogi bgt gw https://t.co/7BVTTjM3PU","1919144332650549562","https://pbs.twimg.com/amplify_video_thumb/1919015657380950016/img/D7Etl3fJkEvXRzcP.jpg","","in","100% Honey, OffNew addict 🔞","0","0","23","https://x.com/ourcspolarrrie_/status/1919144332650549562","1682709498547535873","ourcspolarrrie_"
"1920082655304987110","Wed May 07 11:45:53 +0000 2025","3","Nggak pernah tertarik menjadi cewek yang kejam demi nge-keep cowok. Tapi selalu mengingatkan diri supaya jangan pernah bucin ke cowok. Sehebat apapun si cowok mencintai sewajarnya aja. Yang penting bisa pegang komitmen alias nggak macem2 tapi nggak perlu sampai bucin. ","1920082655304987110","","","in","","0","0","0","https://x.com/bukangulagula/status/1920082655304987110","898412153543180288","bukangulagula"
"1919585942001868990","Tue May 06 02:52:07 +0000 2025","3","Ohhh ternyata ini jawaban dari mimpinya https://t.co/uHdtt1NYk0","1919585942001868990","https://pbs.twimg.com/media/GqO9PMibAAIPJ34.jpg","","in","","0","0","0","https://x.com/bucinLDR/status/1919585942001868990","225383069","bucinLDR"
"1920036882156793951","Wed May 07 08:43:59 +0000 2025","3","Kaget banget bangun tidur buka notif si mas ini update. Makin kaget pas buka notifnya ternyata doi selfie (kalau soal doi selfie bareng ayangnya walaupun cuma foto di tembok udah gak kaget. Kan emang udah bucin mentok) :) https://t.co/5Aw05QoAWR","1920036882156793951","https://pbs.twimg.com/ext_tw_video_thumb/1920036867166334976/pu/img/8AEMj15mvgO3Qrxp.jpg","","in"," MINOR, GET OUT!!!","0","0","2","https://x.com/winniedepreshit/status/1920036882156793951","1748505163189653504","winniedepreshit"
"1921225009600577792","Sat May 10 15:25:11 +0000 2025","15","myu! sender looking for responden terutama yang bucin herta ada 2 esp untuk trailblazer yg beruntung. sender drop linkny di bawah yaaa atau boleh komen nnti sender meluncur ke dm nya. tia https://t.co/Y9jsMOmcjA","1921225009600577792","https://pbs.twimg.com/media/GqmP9tQWcAAotDf.jpg","","in","Amphoreus✨","0","9","5","https://x.com/myufess/status/1921225009600577792","1879425724161069056","myufess"
"1921513665976549781","Sun May 11 10:32:12 +0000 2025","87","maaf kalo tl gue kebanyakan nyindir hari ini karna gue udah muak bgt cok. ampe di katain fans dajjal loh kalian ini apa? mau kita hargai ga? kalo mau kita hargai lo belajar sopan santun dulu mending","1921513665976549781","","","in","bikini bottom 🫧🪸🫙🐬🧜‍♀️","0","0","7","https://x.com/redhorse44/status/1921513665976549781","1642331059634442241","redhorse44"
"1921526081103827077","Sun May 11 11:21:32 +0000 2025","5","udah ges jangan marah marah lagi mereka jg ga bakal sadar","1921526081103827077","","","in","bikini bottom 🫧🪸🫙🐬🧜‍♀️","0","0","1","https://x.com/redhorse44/status/1921526081103827077","1642331059634442241","redhorse44"
"1921207469847544299","Sat May 10 14:15:29 +0000 2025","45","sehari kaga nge roasting sinetron agejet seperti ada bumbu bumbu yg kurang dalam hidup ini","1921207469847544299","","","in","bikini bottom 🫧🪸🫙🐬🧜‍♀️","0","1","0","https://x.com/redhorse44/status/1921207469847544299","1642331059634442241","redhorse44"
"1918317313843184128","Fri May 02 14:51:02 +0000 2025","10","Kyusung Mini Au #Kyusung Kyu : yg mana beb orangnya yg td ngejek kamu Yeye : yg itu tuu Kyu : as* lu . . Wkwkwkwk aduh maaf maaf gabut aku ","1918317313843184128","","","in","dusun majasri","0","1","0","https://x.com/BeUrCLOUDS/status/1918317313843184128","2995021591","BeUrCLOUDS"
"1920359294387826760","Thu May 08 06:05:08 +0000 2025","187","what if cio yang tawuran jacob yang ngomel ngomel ( tapi kalo urusan bucin mah sama aja ) https://t.co/MC2QUHwph9","1920359294387826760","https://pbs.twimg.com/media/GqZ8mLUXoAA1Tp1.jpg","","in","","0","2","28","https://x.com/zhngchenleo/status/1920359294387826760","1384515224544309251","zhngchenleo"
"1918748523966919065","Sat May 03 19:24:31 +0000 2025","138","GUA JUGA MAU BUCIN AJGGG LU PIKIR GUA GAMAU GT FOTO MIRROR TRS DIPOST PKE LAGU HUMMING","1918748523966919065","","","in","","7","21","43","https://x.com/pecelanyam/status/1918748523966919065","1560222493264162816","pecelanyam"
"1918953666859413543","Sun May 04 08:59:41 +0000 2025","24","bucin! have i not hinted enough that i like you? want u so bad","1918953666859413543","","","en","Ganesha, Jatinangor, Cirebon","3","1","3","https://x.com/DraftAnakITB/status/1918953666859413543","1804409229442453505","DraftAnakITB"
"1921513809589453040","Sun May 11 10:32:46 +0000 2025","24","cp lu kaga ada chemistry nya maaf boring bgt gue liatnya","1921513809589453040","","","in","bikini bottom 🫧🪸🫙🐬🧜‍♀️","0","0","6","https://x.com/redhorse44/status/1921513809589453040","1642331059634442241","redhorse44"
"1921137993051525158","Sat May 10 09:39:25 +0000 2025","274","Mav kalau sensitip tapi kalian anak UT! yang kuliah sambil kerja tuh sempet pacaran / bucin gak? Rutinitas sender perasaan padat banget. Subuh olahraga pagi-sore kerja malem tuton ","1921137993051525158","","","in","","54","146","13","https://x.com/utfess/status/1921137993051525158","1451424492719251460","utfess"
"1921501411663069428","Sun May 11 09:43:30 +0000 2025","126","gue kalo disana juga bakal teriak MOQEEL AMPE AKHIRRRRRR","1921501411663069428","","","in","bikini bottom 🫧🪸🫙🐬🧜‍♀️","0","0","7","https://x.com/redhorse44/status/1921501411663069428","1642331059634442241","redhorse44"
"1920700001899991124","Fri May 09 04:38:59 +0000 2025","6"," This scene feels like what I once saw on a screen #HOPE_ON_THE_STAGE_TOUR #HOPE_ON_THE_STAGE_TOUR_JAKARTA #JHOPE_TOUR #HOS_TOUR_JAKARTA_D2 https://t.co/FP6nACkkoa","1920700001899991124","https://pbs.twimg.com/amplify_video_thumb/1920699874946826240/img/VgdGG7OFIeaH0HKC.jpg","","en","","0","0","0","https://x.com/bucinLDR/status/1920700001899991124","225383069","bucinLDR"
"1920888075430805755","Fri May 09 17:06:20 +0000 2025","2701","kim bucin mingyu detected https://t.co/5RDZH0TSDJ","1920888075430805755","https://pbs.twimg.com/amplify_video_thumb/1920888015876222976/img/_mqpexNZ5cAQYrpU.jpg","","hu","rps 21+ ( minwon )","6","0","532","https://x.com/minwoniryu/status/1920888075430805755","1771515708142481408","minwoniryu"
"1920685190998897018","Fri May 09 03:40:08 +0000 2025","161","REKOMENDASI /wp/ posesif bucin gt donggg yang butterfly friendly wkwkwk thanks beforeee","1920685190998897018","","","in","","2","14","13","https://x.com/wattpadmenfess_/status/1920685190998897018","1308443040449585152","wattpadmenfess_"
"1921511136999989757","Sun May 11 10:22:09 +0000 2025","150","kita di kasih interaksi dikit bgt loh? kok keliatan panas bgt fans sebelah takut kita TAMBAH TERANG ya? tau kok chemistry mq se dahsyat itu walaupun tatap-tatapan doang","1921511136999989757","","","in","bikini bottom 🫧🪸🫙🐬🧜‍♀️","1","0","43","https://x.com/redhorse44/status/1921511136999989757","1642331059634442241","redhorse44"
"1918282393741607197","Fri May 02 12:32:17 +0000 2025","403"," taeshan few tweets au nala thio join trend bucin (fomo) https://t.co/8aRI9MEvyJ","1918282393741607197","https://pbs.twimg.com/media/Gp8bqDDawAMtK13.jpg","","en","rps.","4","1","80","https://x.com/gfzhomo/status/1918282393741607197","1908923685333012480","gfzhomo"
"1921204933245739016","Sat May 10 14:05:25 +0000 2025","230","yang besok nyampah di love fest alias ngelempar botol ke cimit gue AWAS AJA GUE TANDAIN MUKA LO","1921204933245739016","","","in","bikini bottom 🫧🪸🫙🐬🧜‍♀️","0","3","16","https://x.com/redhorse44/status/1921204933245739016","1642331059634442241","redhorse44"
"1918877685687714005","Sun May 04 03:57:45 +0000 2025","80"," It seems Ba will attend the Dior event in SH on May 8th; that's why she won't participate in the #TheTruth recording that day. #Dilireba #Dilraba #迪丽热巴 https://t.co/p44PqfORfq","1918877685687714005","https://pbs.twimg.com/media/GqE5EVVaUAAEO0j.jpg","","en","","2","3","15","https://x.com/BucinYangDi1188/status/1918877685687714005","1448969372689526788","BucinYangDi1188"
"1921414895599260022","Sun May 11 03:59:43 +0000 2025","2","liat khasus yg lagi rame trs baru liat orang2 rata2 ngaku klau pada ngbiasin Iqbal pas jaman dulu sedangkan gue dulu bener2 bucin Bastian bgt anjr aplgi dulu tuh lagu dia enak2 bgt kyk lelah selfie juara di hati dll pokoknya smpe gue tulis liriknya di buku gue","1921414895599260022","","","in","jual app prem (dm for pl)","1","1","0","https://x.com/haefsfullsunie/status/1921414895599260022","1720425332443148288","haefsfullsunie"
"1921228366738342158","Sat May 10 15:38:31 +0000 2025","118","emang semuanya tentang duit etika pun sampai lupa. Maksud gua ya Nicole as pemeran utama kenapa posternya di taro antara Noel sama El? kan bisa di taro bareng aqeela sama raisa. Perkara fatso ga hadir kok kelakuan lu se enaknya aja","1921228366738342158","","","in","bikini bottom 🫧🪸🫙🐬🧜‍♀️","0","0","0","https://x.com/redhorse44/status/1921228366738342158","1642331059634442241","redhorse44"
