"conversation_id_str","created_at","favorite_count","full_text","id_str","image_url","in_reply_to_screen_name","lang","location","quote_count","reply_count","retweet_count","tweet_url","user_id_str","username"
"1920600324181496280","Thu May 08 22:02:54 +0000 2025","13","Morning️ https://t.co/ii3tmQH3ZA","1920600324181496280","https://pbs.twimg.com/amplify_video_thumb/1920465150462525440/img/iVUDrkvJGC9-xyce.jpg","","en","","0","0","4","https://x.com/nrwttitiii/status/1920600324181496280","1290688948059041793","nrwttitiii"
"1921129865706607097","Sat May 10 09:07:07 +0000 2025","7","ENGGA KOK MATTYYYYYYY GEMES BGT SI ORMIS SATU ENIH &gt;3 SIAPA MATTHEW AGZ EPS 159 #MatthewIsComingForYou #BewareOfOrmis https://t.co/8QNGWf9RC3","1921129865706607097","https://pbs.twimg.com/media/Gqk5bjQXcAEvgwL.jpg","","in","bikini bottom 🫧🪸🫙🐬🧜‍♀️","1","4","0","https://x.com/redhorse44/status/1921129865706607097","1642331059634442241","redhorse44"
"1921225216593981924","Sat May 10 15:26:00 +0000 2025","6","Hi cowok baik di rp ini banyak yang bucin perhatian pengertian dan lainnya. Tapi sayang mereka bukan untuk aku. So sad ","1921225216593981924","","","in","contact: @selfolsupport","8","28","3","https://x.com/selfolssi/status/1921225216593981924","1317650104937967616","selfolssi"
"1921470435646145015","Sun May 11 07:40:25 +0000 2025","4"," mhsiswa tolong drop au mahae yang berawal dari perjodohan tapi ujungnya bucin to the max donggg","1921470435646145015","","","in","MKHC • 🇨🇦🇰🇷","0","2","0","https://x.com/mahaeunited/status/1921470435646145015","918126676944371718","mahaeunited"
"1919206616081023092","Mon May 05 01:44:49 +0000 2025","28","Berhasil menamatkan misi UI Open Days 2025! https://t.co/IPxHOxw1pN","1919206616081023092","https://pbs.twimg.com/media/GqJkPZ2bEAA9cUF.jpg","","in","Universitas Indonesia","0","1","0","https://x.com/bucin_ui/status/1919206616081023092","1177748206735638529","bucin_ui"
"1921059252233236996","Sat May 10 04:26:31 +0000 2025","243","Cara Tul buat Mew salting haha I'm having lovesick I'm chieftain's boyfriend For the cutie to eat first #mewtul https://t.co/IDVRjk6UZd","1921059252233236996","https://pbs.twimg.com/ext_tw_video_thumb/1921045388557000705/pu/img/1R-olnIME8FdEWme.jpg","","en","","0","0","25","https://x.com/wemewemewem/status/1921059252233236996","1354888741790208000","wemewemewem"
"1919225663313019040","Mon May 05 03:00:30 +0000 2025","60","Pay tribute to May Fourth with literary and artistic workers. Spread the positive energy of youth with #YangYang and #Dilraba #YangYang杨洋 #杨洋 #Dilireba #迪丽热巴 #YangDi https://t.co/TG0FxEoZNP","1919225663313019040","https://pbs.twimg.com/media/GqJ1kb0agAA0DYI.jpg","","en","","2","0","11","https://x.com/BucinYangDi1188/status/1919225663313019040","1448969372689526788","BucinYangDi1188"
"1921194633343713417","Sat May 10 13:24:29 +0000 2025","57","Milk wkwkkw yang sabar ya sebelahan sama pasangan bucin Kasihann #poohpavel https://t.co/c7xuHMceu4","1921194633343713417","https://pbs.twimg.com/ext_tw_video_thumb/1921134728217849856/pu/img/w-MuW5g4gmUYO8q_.jpg","","in","","1","0","15","https://x.com/pupukrittin/status/1921194633343713417","1198258761523060737","pupukrittin"
"1921212395529150838","Sat May 10 14:35:04 +0000 2025","11","funfact sidangnya tuh udh kmrn sore tp karena hujan jadi riweuh bgt. sampe ga sadar ada tulisan kyungsoo disini baru sadar tadi siang pas foto ulang. semua orang kayaknya tahu gue bucin kyungsoo https://t.co/nSmSNqVbiC","1921212395529150838","https://pbs.twimg.com/media/GqmEfB0WcAAc7C2.jpg","","in","","0","2","0","https://x.com/chocomints12/status/1921212395529150838","814125690031177729","chocomints12"
"1921211338728014074","Sat May 10 14:30:52 +0000 2025","119","Ada saat² tertentu level bucin meningkat ","1921211338728014074","","","in","dimana² hatiku senang 😂🤣","0","7","0","https://x.com/bossnyaoggy/status/1921211338728014074","1354811256541069314","bossnyaoggy"
"1918996581690360083","Sun May 04 11:50:12 +0000 2025","1121","(titipan) ml! cw // bxg claude x fanny Ini 2 hero mengerikan krn sender bucin banget dan ship mereka tp malas sender sama sekali gabisa makenya Oh iya siapa tau ada yg ship mereka juga? Old art by sender https://t.co/pgnnMvuny9","1918996581690360083","https://pbs.twimg.com/media/GqGlOG4XMAApzp4.png","","in","Land of Dawn","48","105","127","https://x.com/mlbbfess/status/1918996581690360083","1477867346","mlbbfess"
"1918973060247666829","Sun May 04 10:16:45 +0000 2025","188","building businesses together ️ building house and family #mewtul https://t.co/BzioPD3nI1","1918973060247666829","https://pbs.twimg.com/ext_tw_video_thumb/1918971407016574976/pu/img/TjlvFdVOLRl-yz2x.jpg","","en","","0","1","41","https://x.com/wemewemewem/status/1918973060247666829","1354888741790208000","wemewemewem"
